{
  "id": "synth_two_room",
  "scale": "1/8in=1ft",
  "image_size_px": [
    2200,
    1500
  ],
  "rooms": [
    {
      "id": "R1",
      "bbox_px": [
        198,
        238,
        776,
        922
      ],
      "area_raw": 1220.2
    },
    {
      "id": "R2",
      "bbox_px": [
        785,
        238,
        1242,
        922
      ],
      "area_raw": 964.8
    }
  ],
  "walls": [
    {
      "id": "ext_n",
      "px_coords": [
        180,
        229.0,
        1260,
        229.0
      ],
      "facing": "North",
      "is_exterior": true,
      "length_raw": 60.0
    },
    {
      "id": "ext_s",
      "px_coords": [
        180,
        931.0,
        1260,
        931.0
      ],
      "facing": "South",
      "is_exterior": true,
      "length_raw": 60.0
    },
    {
      "id": "ext_w",
      "px_coords": [
        189.0,
        220,
        189.0,
        940
      ],
      "facing": "West",
      "is_exterior": true,
      "length_raw": 40.0
    },
    {
      "id": "ext_e",
      "px_coords": [
        1251.0,
        220,
        1251.0,
        940
      ],
      "facing": "East",
      "is_exterior": true,
      "length_raw": 40.0
    },
    {
      "id": "int_1",
      "px_coords": [
        780,
        238,
        780,
        922
      ],
      "facing": "West",
      "is_exterior": false,
      "length_raw": 38.0
    }
  ],
  "doors": [
    {
      "id": "d1",
      "host_wall_id": "int_1",
      "bbox_px": [
        773,
        600,
        788,
        636
      ],
      "center_px": [
        780,
        618.0
      ]
    }
  ],
  "windows": [
    {
      "id": "win1",
      "host_wall_id": "ext_n",
      "bbox_px": [
        360,
        220,
        432,
        238
      ],
      "center_px": [
        396.0,
        229.0
      ]
    },
    {
      "id": "win2",
      "host_wall_id": "ext_n",
      "bbox_px": [
        980,
        220,
        1052,
        238
      ],
      "center_px": [
        1016.0,
        229.0
      ]
    }
  ],
  "labels": [],
  "dimensions": [
    {
      "id": "dim1",
      "text": "60'-0\"",
      "value_raw": 60.0,
      "unit": "ft",
      "center_px": [
        720.0,
        1040.0
      ]
    },
    {
      "id": "dim2",
      "text": "40'-0\"",
      "value_raw": 40.0,
      "unit": "ft",
      "center_px": [
        140.0,
        580.0
      ]
    }
  ]
}