{
  "id": "labelme_fp_25_2",
  "scale": "1in=1ft",
  "image_size_px": [
    1911,
    2941
  ],
  "rooms": [
    {
      "id": "R1",
      "bbox_px": [
        375.5000000000001,
        638.0000000000001,
        1408.0,
        1670.5
      ]
    },
    {
      "id": "R2",
      "polygon_px": [
        [
          370.4122807017545,
          1756.4649122807016
        ],
        [
          1407.2543859649122,
          1758.219298245614
        ],
        [
          1402.8684210526317,
          2792.868421052631
        ],
        [
          908.1315789473686,
          2792.868421052631
        ],
        [
          902.8684210526317,
          1827.078947368421
        ],
        [
          371.28947368421063,
          1819.1842105263156
        ]
      ],
      "bbox_px": [
        370.4122807017545,
        1756.4649122807016,
        1407.2543859649122,
        2792.868421052631
      ]
    }
  ],
  "walls": [
    {
      "id": "w1",
      "px_coords": [
        843.870849609375,
        545.7075401930622,
        843.870849609375,
        2901.9394324631876
      ]
    }
  ],
  "doors": [
    {
      "id": "door_1",
      "bbox_px": [
        293.2777777777778,
        1126.0555555555557,
        824.3888888888888,
        1601.611111111111
      ],
      "center_px": [
        558.8333333333333,
        1363.8333333333335
      ]
    },
    {
      "id": "door_2",
      "bbox_px": [
        288.83333333333337,
        1826.0555555555554,
        822.1666666666666,
        2303.833333333333
      ],
      "center_px": [
        555.5,
        2064.9444444444443
      ]
    }
  ],
  "windows": [],
  "labels": [
    {
      "id": "label_1",
      "text": "Text",
      "bbox_px": [
        832.5588235294117,
        396.38235294117646,
        943.1470588235295,
        439.9117647058823
      ],
      "center_px": [
        887.8529411764706,
        418.1470588235294
      ]
    },
    {
      "id": "label_2",
      "text": "Text",
      "bbox_px": [
        793.7352941176471,
        896.3823529411766,
        1020.7941176470588,
        1048.1470588235295
      ],
      "center_px": [
        907.2647058823529,
        972.264705882353
      ]
    },
    {
      "id": "label_3",
      "text": "Text",
      "bbox_px": [
        776.2142857142858,
        2148.0,
        1031.9285714285713,
        2301.5714285714284
      ],
      "center_px": [
        904.0714285714286,
        2224.785714285714
      ]
    },
    {
      "id": "label_4",
      "text": "Text",
      "bbox_px": [
        266.76126126126127,
        2041.445945945946,
        391.08558558558553,
        2103.6081081081084
      ],
      "center_px": [
        328.9234234234234,
        2072.527027027027
      ]
    },
    {
      "id": "label_5",
      "text": "Text",
      "bbox_px": [
        167.99999999999997,
        2228.3125,
        202.37499999999997,
        2327.2708333333335
      ],
      "center_px": [
        185.18749999999997,
        2277.791666666667
      ]
    },
    {
      "id": "label_6",
      "text": "Text",
      "bbox_px": [
        470.2058823529411,
        2299.9117647058824,
        770.2058823529412,
        2602.264705882353
      ],
      "center_px": [
        620.2058823529412,
        2451.088235294118
      ]
    },
    {
      "id": "label_7",
      "text": "Text",
      "bbox_px": [
        1647.8529411764707,
        1690.7941176470588,
        1879.029411764706,
        1840.7941176470588
      ],
      "center_px": [
        1763.4411764705883,
        1765.7941176470588
      ]
    },
    {
      "id": "label_8",
      "text": "Text",
      "bbox_px": [
        166.5169491525424,
        1098.8898305084745,
        207.19491525423734,
        1203.9745762711864
      ],
      "center_px": [
        186.85593220338987,
        1151.4322033898304
      ]
    },
    {
      "id": "label_9",
      "text": "Text",
      "bbox_px": [
        267.5,
        1339.3,
        389.90000000000003,
        1405.7
      ],
      "center_px": [
        328.70000000000005,
        1372.5
      ]
    },
    {
      "id": "label_10",
      "text": "Text",
      "bbox_px": [
        786.4090909090909,
        1075.0454545454547,
        905.8030303030301,
        1211.409090909091
      ],
      "center_px": [
        846.1060606060605,
        1143.227272727273
      ]
    },
    {
      "id": "label_11",
      "text": "Text",
      "bbox_px": [
        90.1153846153847,
        74.34615384615392,
        243.9615384615385,
        226.6538461538462
      ],
      "center_px": [
        167.0384615384616,
        150.50000000000006
      ]
    }
  ],
  "dimensions": []
}