{
  "id": "synth_l_shape",
  "scale": "1/8in=1ft",
  "image_size_px": [
    2400,
    1600
  ],
  "rooms": [
    {
      "id": "R1",
      "bbox_px": [
        178,
        238,
        1222,
        776
      ],
      "polygon_px": [
        [
          178,
          238
        ],
        [
          772,
          238
        ],
        [
          772,
          598
        ],
        [
          1222,
          598
        ],
        [
          1222,
          776
        ],
        [
          178,
          776
        ]
      ]
    },
    {
      "id": "R2",
      "bbox_px": [
        178,
        785,
        1222,
        1102
      ]
    }
  ],
  "walls": [
    {
      "id": "ext_top",
      "px_coords": [
        160,
        229.0,
        790,
        229.0
      ],
      "facing": "North",
      "is_exterior": true,
      "length_raw": 35.0
    },
    {
      "id": "ext_notch_v",
      "px_coords": [
        781.0,
        220,
        781.0,
        580
      ],
      "facing": "East",
      "is_exterior": true,
      "length_raw": 20.0
    },
    {
      "id": "ext_notch_h",
      "px_coords": [
        790,
        589.0,
        1240,
        589.0
      ],
      "facing": "North",
      "is_exterior": true,
      "length_raw": 25.0
    },
    {
      "id": "ext_e",
      "px_coords": [
        1231.0,
        580,
        1231.0,
        1120
      ],
      "facing": "East",
      "is_exterior": true,
      "length_raw": 30.0
    },
    {
      "id": "ext_s",
      "px_coords": [
        160,
        1111.0,
        1240,
        1111.0
      ],
      "facing": "South",
      "is_exterior": true,
      "length_raw": 60.0
    },
    {
      "id": "ext_w",
      "px_coords": [
        169.0,
        220,
        169.0,
        1120
      ],
      "facing": "West",
      "is_exterior": true,
      "length_raw": 50.0
    },
    {
      "id": "int_1",
      "px_coords": [
        178,
        780,
        1222,
        780
      ],
      "facing": "North",
      "is_exterior": false,
      "length_raw": 58.0
    }
  ],
  "doors": [
    {
      "id": "d1",
      "host_wall_id": "int_1",
      "bbox_px": [
        700,
        773,
        736,
        788
      ],
      "center_px": [
        718.0,
        780
      ]
    }
  ],
  "windows": [],
  "labels": [],
  "dimensions": [
    {
      "id": "dim1",
      "text": "60'-0\"",
      "value_raw": 60.0,
      "unit": "ft",
      "center_px": [
        700.0,
        1240.0
      ]
    }
  ]
}