{
  "id": "labelme_fp_54_2",
  "scale": "1in=1ft",
  "image_size_px": [
    2256,
    1751
  ],
  "rooms": [
    {
      "id": "R1",
      "polygon_px": [
        [
          493.51724137931035,
          584.1206896551723
        ],
        [
          1146.9655172413795,
          582.3965517241379
        ],
        [
          1148.689655172414,
          608.2586206896551
        ],
        [
          1505.5862068965516,
          609.9827586206897
        ],
        [
          1509.034482758621,
          1003.0862068965516
        ],
        [
          495.2413793103449,
          999.6379310344828
        ]
      ],
      "bbox_px": [
        493.51724137931035,
        582.3965517241379,
        1509.034482758621,
        1003.0862068965516
      ]
    },
    {
      "id": "R2",
      "bbox_px": [
        352.1379310344828,
        1056.5344827586207,
        955.5862068965517,
        1494.4655172413793
      ]
    },
    {
      "id": "R3",
      "bbox_px": [
        1014.2068965517243,
        1058.2586206896551,
        1415.9310344827586,
        1496.1896551724137
      ]
    }
  ],
  "walls": [
    {
      "id": "w1",
      "px_coords": [
        356.3750331705778,
        1047.423583984375,
        1618.3410312825472,
        1047.423583984375
      ]
    }
  ],
  "doors": [],
  "windows": [],
  "labels": [
    {
      "id": "label_1",
      "text": "Text",
      "bbox_px": [
        1475.560975609756,
        296.23170731707324,
        2234.0975609756097,
        425.50000000000006
      ],
      "center_px": [
        1854.8292682926829,
        360.86585365853665
      ]
    },
    {
      "id": "label_2",
      "text": "Text",
      "bbox_px": [
        1092.9606299212599,
        44.397637795275585,
        1168.5511811023623,
        121.56299212598427
      ],
      "center_px": [
        1130.755905511811,
        82.98031496062993
      ]
    },
    {
      "id": "label_3",
      "text": "Text",
      "bbox_px": [
        1130.3364485981308,
        344.1915887850468,
        1163.981308411215,
        382.50934579439263
      ],
      "center_px": [
        1147.1588785046729,
        363.35046728971975
      ]
    },
    {
      "id": "label_4",
      "text": "Text",
      "bbox_px": [
        705.2727272727273,
        614.1363636363637,
        890.5,
        748.2272727272729
      ],
      "center_px": [
        797.8863636363636,
        681.1818181818182
      ]
    },
    {
      "id": "label_5",
      "text": "Text",
      "bbox_px": [
        564.6906474820144,
        1143.8453237410072,
        748.863309352518,
        1221.5431654676258
      ],
      "center_px": [
        656.7769784172662,
        1182.6942446043165
      ]
    },
    {
      "id": "label_6",
      "text": "Text",
      "bbox_px": [
        978.8695652173913,
        1094.6304347826087,
        1209.304347826087,
        1178.9782608695652
      ],
      "center_px": [
        1094.086956521739,
        1136.804347826087
      ]
    },
    {
      "id": "label_7",
      "text": "Text",
      "bbox_px": [
        1037.1304347826087,
        1179.8478260869565,
        1159.7391304347825,
        1275.5
      ],
      "center_px": [
        1098.4347826086955,
        1227.6739130434783
      ]
    },
    {
      "id": "label_8",
      "text": "Text",
      "bbox_px": [
        1727.2857142857142,
        1123.3571428571427,
        2195.8571428571427,
        1266.2142857142856
      ],
      "center_px": [
        1961.5714285714284,
        1194.7857142857142
      ]
    },
    {
      "id": "label_9",
      "text": "Text",
      "bbox_px": [
        1899.2962962962963,
        512.5370370370371,
        1986.3333333333333,
        595.8703703703703
      ],
      "center_px": [
        1942.8148148148148,
        554.2037037037037
      ]
    },
    {
      "id": "label_10",
      "text": "Text",
      "bbox_px": [
        1902.9999999999998,
        1490.3148148148148,
        1986.3333333333333,
        1568.0925925925926
      ],
      "center_px": [
        1944.6666666666665,
        1529.2037037037037
      ]
    },
    {
      "id": "label_11",
      "text": "Text",
      "bbox_px": [
        1290.7659574468087,
        826.5638297872341,
        1420.5531914893618,
        935.0744680851063
      ],
      "center_px": [
        1355.6595744680853,
        880.8191489361702
      ]
    }
  ],
  "dimensions": []
}